{
  "task_spec_version": "0.1.0",
  "task_id": "structured_extraction_001",
  "task_type": "structured_extraction",
  "intent": {
    "goal": "Extract project metadata from a fixed proposal excerpt.",
    "language": "en",
    "freshness": "local_snapshot"
  },
  "constraints": [
    "Do not infer missing fields.",
    "Return only fields supported by the evidence bundle.",
    "Mark absent fields as null."
  ],
  "required_skills": [],
  "allowed_tools": [],
  "risk_profile": "low",
  "memory_slice_id": "mem_structured_extraction_001",
  "evidence_bundle_id": "ev_structured_extraction_001",
  "output_contract_id": "out_structured_extraction_001"
}

