{
  "task_spec_version": "0.1.0",
  "task_id": "mechanism_a1_schema_bound_extraction_001",
  "task_type": "mechanism_atom",
  "intent": {
    "goal": "Return a valid JSON object with required planning fields and supported evidence IDs.",
    "language": "en",
    "freshness": "local_snapshot"
  },
  "constraints": [
    "Primary mechanism under test: OutputContract.",
    "Dominant failure mode: Missing required structure.",
    "Return only information supported by the fixture."
  ],
  "required_skills": [],
  "allowed_tools": [],
  "risk_profile": "medium",
  "memory_slice_id": "mem_mechanism_a1_schema_bound_extraction_001",
  "evidence_bundle_id": "ev_mechanism_a1_schema_bound_extraction_001",
  "output_contract_id": "out_mechanism_a1_schema_bound_extraction_001"
}
